Adam 156 Sub-zero Abyss	3199439626	Can't register dvar
Adam 156 Urban Parachute	2082640650	No file descriptor available
Adam 18 Miami Case	2612114442	Firing a weapon with fire type Aim Only.
Adam 564 Stealth Zombie	904544970	Attempt to register Client Field post finalization of Client Field registration period failed.
Adam 614 Steel Retreat	2258850890	No clientfield named found in set.
Alfa 559 Metallic Python	1046896252	not an entity
Alfa 597 Sapphire Missile	1991549692	Error initializing lzma
Baker 223 Meridian Absolution	3990130335	player getperks(<localClientNum>): localClientNum out of range
Baker 441 Proper Section	2346900383	not an object
Baker 546 Vengeful Gladiator	3320597663	SetSavedDvar can only be called on dvars with the SAVED flag set
Baker 917 Brute Goodnight	4104994143	can't allocate more script variables
Boy 108 Sapphire Sagittarius	766802866	Invalid fastfile header
Boy 145 Destructive Tank	3304446514	not an entity
Boy 44 Blood Lamprey	3971544690	time cannot be negative
Boy 533 Calm Uncle	2873910834	Corrupt or invalid string reference (not a valid string)
Boy 601 Everest Tiger	312545010	not a vector
Boy 618 Platinum Badger	271075570	Invalid gunner weapon specified
Boy 851 Revolutionary Locker	2214262642	mission index out of range
Boy 856 Burner Eclipse	1015938482	not an entity
Boy 918 Monster Gorilla	364298674	not an actor
Boy 986 Extreme Crossbones	3488519410	object is not an array, string, or vector
Bravo 228 Blind Defense	1666590335	not an int
Bravo 420 Marble Leviathan	4163356671	mission index out of range
Bravo 421 Gold Marauder	1461218623	string index out of range
Bravo 492 Wild Convoy	1616125503	not an entity
Bravo 659 Operation Bear	57350207	Unknown perk
Bravo 727 Marble Missile	1982281215	exceeded message limit
Bravo 822 Grizzly Cover	2658987327	Invalid string
Cast 166 Quick Menace	1431456749	not a script function
Cast 222 Rapid Operator	1492330861	script stack overflow (too many embedded function calls)
Cast 245 Classic Retreat	2255127213	Parameter must be an array
Cast 335 Midas Stallion	952690413	parameter can't be cast to a number
Cast 422 Cloaked Firestarter	3429737773	getweaponaccuracy must be called on an AI only
Cast 496 Cloaked Legend	2725053485	caller is not an object
Cast 501 Chief Werewolf	962032109	Entity does not exist.
Cast 621 Broken Mirage	3263266093	DirectX Error
Cast 82 Disguised Python	1047459117	Entity is not a rocket
Cast 899 Dazed Management	4242478637	Trying to read corrupted file
Charlie 1009 War Leviathan	4163774148	Optional argument must be a float or integer type
Charlie 19 Loud Arrow	1498641348	not an array
Charlie 285 Military Gorilla	359760836	G_Spawn: no free entities
Charlie 332 Apocalyptic Theater	2504938884	outfit id out of bound
Charlie 376 Steel Alligator	1168374532	Trying to read corrupted file
Charlie 530 Cut Security	2036025092	formatting can only be used with player entity, string, hash, int or float
Charlie 555 Acid Jackpot	3812357892	script stack overflow (too many embedded function calls)
Charlie 643 Ace Alligator	1167526340	invalid session mode
Collar 433 Covert Salute	2306441167	invalid seat position.
Collar 543 Satellite Fort	1756043215	Usage: kill( <source position>, <attacker>, <inflictor>, <weapon>)
Collar 738 Destructive Crocodile	1156941583	Invalid threat bias group
Collar 772 Flying Shell	2378228303	invalid session mode
Collar 974 Furious Tornado	177453967	bad dvar type
David 1016 Grizzly Squad	2440869003	can't find item for mode
David 151 Gothic Garrison	1770186571	invalid loadout slot
David 180 Camouflaged Asset	2572009355	vector scale expecting vector
David 246 Violet Axe	285416523	not an object
David 368 Fast Highway	3596277323	endoncallback must have at least one valid argument
David 625 Metal Fog	812063243	Array index not a valid type, expecting an int, string, or entity type
David 658 Battle Mole	2737681163	assert fail (with message)
David 692 Clockwork Fury	2945837835	not an object
David 888 Patient Bayonet	1517473035	Value out of range.  Allowed values: 0 to 2
Delta 18 Foolish Mamba	1273214009	CScr_PlayFX: invalid effect
Delta 233 Desolate Yeti	3875481145	First argument of a match call must be a pointer to a struct
Delta 29 Desert Bandit	3205256249	Kill failed
Delta 291 Operation Stockade	2473308409	Execution Queue out of memory
Delta 320 Monster Tornado	179749049	cannot cast to bool
Delta 321 Classic Corps	1634348473	Vehicles only support bullet, bomb, gas, grenade and projectile weapons
Delta 357 Divebomb Fleet	1703931129	Trying to read corrupted file
Delta 418 Boiling Overlord	2909354809	invalid team name (not possible)
Delta 515 United Mauler	3137736761	script stack overflow (too many embedded function calls)
Delta 694 Fierce Fort	1752379961	param is not an object
Delta 796 Nightshade Artillery	2274889209	Invalid type passed in from array into waittill parameter list
Delta 884 Aggressive Sunrise	3706227705	Invalid threat bias group
Delta 899 Urban Claw	2955023929	not an object
Dog 199 Violet Management	4228099247	Time must be positive
Dog 415 Dry Owl	409067247	No clientfield named found in set.
Dog 557 Mythic Werewolf	969013743	The server sent us a config checksum but we have don't have one
Dog 620 Barricaded Rage	3042707823	Corrupt or invalid string reference (not a string)
Dog 805 Due Alligator	1170973103	checksum/mapcrc mismatch
East 1005 Found Badger	269518924	Ammo count must not be negative
East 211 Dual Munition	2019033740	mission index out of range
East 481 Knockout Crossbones	3482075788	caller is not an object
East 511 Blue Gemini	654494860	Profile Variable has an invalid name
Echo 428 Camouflaged Goat	1246623636	not an entity
Echo 507 Bigfoot Security	2040697556	Read error of file
Echo 51 Emerald Section	2344222932	assert fail
Echo 526 Cut Bridge	2589667284	invalid velocity parameter in moveslide command
Echo 530 Undercover Contraband	2706458388	Trying to get a local client index for a client that is not a local client.
Echo 690 Dazed Owl	4173088841	xpak file does not contain a valid header
Echo 758 Sleeper Pavement	3615151060	SysError in thread (msg)
Echo 782 Shellshocked Artillery	2269096660	vector scale expecting vector
Echo 795 Tan Mirage	3256105940	Could not find zone
Echo 819 Ballistic Hound	493677524	Cannot delete entity during its think
Echo 828 Hurt Scorpio	744499668	too many vehicles
Edward 388 Embattled Ultra	2855209542	Cannot call IncrementClientField on a non-'counter' type clientfield.
Edward 427 Platinum Mirage	3257432710	type is not a float or int
Edward 43 Sleeper Sabotage	2289696774	Driver Internal Error
Edward 522 Risky Wolverine	1132507782	bad opcode
Edward 807 Revolutionary Cover	2667191558	Unknown ent type in GScr_GetFieldSetForEntityType.
Edward 943 Bogus Siege	2386350598	index is an illegal objective index.
Fall 146 Unlimited Activity	4042343709	bad anim tree
Fall 242 Resolute Force	1721606685	script stack overflow (too many embedded function calls)
Fall 29 Tall Undertow	3410121757	cannot cast to bool
Fall 313 Nickel Operator	1478783005	Pointer types passed into waittill_timeout expressions must evaluate as arrays
Fall 344 Camouflaged Cover	2655888797	endon must have at least one valid argument
Fall 372 Dangerous Puma	924957661	Time must be positive
Fall 388 Quick Conflict	1364331101	Object must be an array
Fall 508 Solo Defense	1668598749	 not an object
Fall 52 Air Spear	2921226909	Can't register dvar
Fall 640 Risky Sunrise	3699398237	controllerIndex doesn't index MAX_GPAD_COUNT
Fall 697 Defiant Owl	417653725	EXE_PATCH_STATSOVERFLOW
Fall 78 Sub-zero Serpent	3098745181	invalid character index
Fall 828 Divided Razor	3791399389	invalid team name (not possible)
Foxtrot 14 Nuclear Cobra	209668787	RandomInt parm must be positive integer.
Foxtrot 150 Bayou Hound	489261299	Invalid gunner index set in FireWeapon
Foxtrot 187 Aggressive Ordnance	2078816051	not a valid name for a clientfield set.
Foxtrot 345 Strange Pig	1385570291	assert fail (with message)
Foxtrot 426 Air Python	1042158387	First argument of a match call must be a struct
Foxtrot 465 Area Force	1725821875	exceeded message limit
Foxtrot 56 Small Dementor	3222417139	size cannot be applied to type
Frank 1022 Muzzled Missile	1996212680	associativeArray called with unbalanced key/value count.
Frank 175 General Stockade	2479879368	RegisterClientField can only accept bit ranges between 1 and 32.
Frank 25 Good Fort	1746959112	script stack overflow (too many embedded function calls)
Frank 575 Unlimited Salvo	2331090760	stack does not have the pool
Frank 581 Rocky Taurus	648498056	Can't use wait with profiler
Frank 620 Proper Giant	887228744	origin being set to NAN.
Frank 654 Knockout Ice	3633073800	parameter does not exist
Frank 995 General Fleet	1708109640	try to send format param with unknown type
Golf 1002 Desert Beastmaster	3020745427	DirectX Error
Golf 375 Green Ship	2147578195	not a float,
Golf 643 Earth Specialist	2417691091	Execution Queue out of memory
Golf 668 Nuclear Cougar	998219219	parameter does not exist
Golf 974 Urban Bison	1109572499	invalid session mode
Hotel 151 Guerrilla Jackpot	3815761761	Error when loading fastfile
Hotel 173 Tragic Goblin	3459949409	Failed to alloc client field - MAX_CLIENTFIELD_FIELDS_IN_SET=512 exceeded.
Hotel 39 Weak Outlaw	4048135393	Can't find variable
Hotel 418 Grey Management	4229118753	Invalid threat bias group
Hotel 422 Fake Helmet	1816372513	invalid session mode
Hotel 447 Small Absolution	3977444065	ReportLootReward: entity must be a player entity
Hotel 460 United Goblin	3456527393	script stack overflow (too many embedded function calls)
Hotel 511 Meridian Boar	114609313	USAGE: GetInfluencerPreset could not find influencer with name
Hotel 621 Dry Greyhound	476151073	invalid session mode
Hotel 874 Gray Ordnance	2065311777	Entity is not of guidance type Drone
Ida 309 Barricaded Bandit	3210502050	not an object
Ida 635 Rightful Elephant	467754466	Error registering client field.  bCallbacksFor0WhenNew (CF_CALLBACK_ZERO_ON_NEW_ENT) is disallowed for CF_SCRIPTMOVERFIELDS.
Ida 736 Quick Lamprey	3964856290	kill called on an entity with magic bullet shield (FL_DISABLE_DEATH)
Ida 941 Gray Mustang	3894031202	Can't find gamedata/playeranim/playeranimtypes.txt
India 185 Operation Crocodile	1147874990	start time must be between 0 and 1
India 36 Skyline Overlord	2903034222	Invalid mode id
India 441 Stealth Star	3857374126	caller is not an object
India 448 Lost Siege	2385937518	localized istring not precached
India 579 Deadly Gemini	657813230	Error registering client field.  bCallbacksFor0WhenNew (CF_CALLBACK_ZERO_ON_NEW_ENT) is disallowed for counter type clientfields. Due to it's treatment of the old and new val as a ring buffer, the counter type is not valid on a new snapshot, new ent, or demojump
India 811 Max Thunder	530300974	divide by 0
Juliett 283 Apocalyptic Vulture	424587329	not a pathnode
Juliett 43 Sleeper Sabotage	2289696769	DirectX parameter is incorrect.
Juliett 490 Quick Fury	2941436609	Invalid threat bias group
Juliett 510 Blazing Station	2797012161	distMax is less than distMin
Juliett 569 Wild Storm	1398031169	ACTS CUSTOM ERROR ID
Juliett 791 Null Lantern	3678699265	not a pointer
Juliett 820 Melted Badger	272147969	SetAILimit error
Juliett 859 Small Rookie	554833601	Can only do this call for node_turret
June 104 Late Cover	2665902678	CMD_VEH_SetPlaneGoalPos called with a non vector param
June 104 Skyline Boat	2131259990	Can't set read only field
June 150 Gray Noise	3541731542	readonly field
June 229 Bolt Rattlesnake	126603414	Expected type XHash as an argument for GetLocalizedStringIndex()
June 301 Strange Leo	697732694	entity is not a missile
June 426 Hurt Tactics	2489324310	cannot switch on type
June 503 Swamp Lizard	369972438	First argument of a match call must be a struct
June 515 Foolish Convoy	1625493526	Can't find info for script vehicle
June 927 Frozen Clover	3669018198	not an entity
June 951 Prepared Cover	2655465686	not a script function pointer
Kilo 45 Gold Dove	219686544	object is not an array index
Kilo 538 Patient Sagittarius	762454160	not a pointer
Kilo 56 Small Gemini	655503056	script stack overflow (too many embedded function calls)
Kilo 561 Aurora Division	1691103888	ReportLootConsume: entity must be a player entity
Kilo 717 Clockwork Refuge	4220857104	Cannot call IncrementClientField on a 'counter' type clientfield on the frame it is spawned, since newEnts on the clientside will not process 'counter' type clientfields.
King 1002 Fast Linebacker	3059411687	Argument and parameter count mismatch for LUINotifyEvent
King 114 Quick Conflict	1364389287	Our config string checksum doesn't match the server's checksum
King 220 Wartorn Fury	2940210599	Invalid Version Handling. Grab Bat !!!
King 30 Tough Asset	2577695271	SetModel can only be called on a script mover
King 338 Swift Theater	2515363687	invalid message type
King 404 Sapphire Ice	3635717863	end time must be between 0 and 1
King 412 Brimstone Agent	2558883623	SetNearGoalNotifyDist set too small. May not get notify.
King 537 Ghost Hound	487917415	Invalid mission name
King 593 Late Ant	1206320999	getClosestOrFarthestEntity: struct passed in doesn't have an origin
King 703 Due Agent	2563481959	DirectX Error
King 712 Golden Menace	1439117735	value out of range (acos)
Lima 115 Sick Cobra	208009819	Cannot delete a client entity
Lima 486 Flat Apocalypse	3361905947	Pointer is not an entity
Lima 495 Old Security	2033447003	not an array key
Lima 510 Bogus Rescue	2235303131	not a player entity
Lima 886 Flat Jaguar	1080214043	caller is not an object
May 1009 Torched Sunrise	3699844858	model not precached
May 267 Tragic Whisper	3527043258	Com_EventLoop: bad event type
May 612 Snow Obelisk	1333649786	IsMature can only be called on a player.
May 706 Due Sagittarius	768316282	script stack overflow (too many embedded function calls)
May 74 Left Scorpio	744383994	SetLoadingMovie error
May 950 Small Thunder	521321850	invalid session mode
Mike 232 Proper Alligator	1172448744	Max zone count exceeded
Mike 331 Marsh Rain	3509276200	Invalid mission name
Mike 419 Violet Tank	3288551912	expected array type to add value pair
Mike 434 Discovered Garrison	1777362536	Could not allocate memory for zone
Mike 465 Great Theater	2512843688	GetVehicleNode used with more than one node
Mike 628 Screaming Claw	2958072552	slot too high
Mike 664 Steel Lion	245612264	foreach should be used with an array
Mike 988 Gold Lion	236473384	invalid session mode
Negative 1017 Emerald Recruit	2226838967	Blur value must be greater than 0
Negative 140 Goliath Goodnight	4107893047	radiant exploder not cached
Negative 184 Fake Locker	2202233143	waittill_timeout must have at least one valid argument
Negative 274 Right Activity	4032788023	param is not an object
Negative 780 Bad Security	2033364407	Failed to link entity
Negative 8 Tough Doppelganger	4255418935	Pointer types passed into waittill expressions must evaluate as arrays
Negative 806 Armored Cover	2666843255	duplicated field name
Nora 205 Almighty Cipher	2629548679	Entity is not a player
Nora 261 Marsh Blizzard	1412130119	parameter can't be cast to a hash
Nora 264 Dangerous Homerun	4196473479	parameter does not exist
Nora 383 Goliath Bug	2899913735	Loading took too long (>60s)
Nora 43 Sleeper Sabotage	2289696775	DirectX Invalid Call
Nora 669 Shade Goodnight	4100218247	Error sending LUI notify event: LUI event name is not precached.
Nora 836 Rapid Doppelganger	4260626055	first arg to waittill_timeout must evaluate to an integer or float value
Nora 871 Orange Mirage	3255107847	LUINotifyEvent: entity must be a player entity
North 22 Diamond Capricorn	783159414	SysError in thread (no msg)
North 272 Hannibal Defense	1670707254	linking error
North 298 Confused Greyhound	484463798	invalid dlcname or session for maptable
North 662 Military Plane	2104587190	Unknown client field set for clientfield
North 78 Blood Wolf	12065142	invalid session mode
North 803 Swamp Conflict	1359849142	not an entity
North 928 Fake Fury	2940431926	Invalid threat bias group
North 96 Sleeper Demon	544902518	parameter does not exist
November 116 Mythic Scorpio	750896894	Invalid bgCache type
November 268 Wild Greyhound	475330046	Invalid dvar type
November 417 Silver Sunrise	3692510654	Invalid type passed in from array into waittill parameter list
November 588 Barren Carrier	1593720126	Can't register dvar
November 670 Boiling Avalanche	829015102	var isn't a field object
November 817 Tall Shell	2369974846	Invalid threat bias group
November 990 Fake Operator	1480821566	Error registering client field.  Attempted field size is not acceptable bit number range 1->32
Ocean 116 Confused Corps	1642120921	1st param should be a hash or a string
Ocean 270 Grounded Infantry	1850691545	Debug Break
Ocean 281 Conflicted Outlander	3913663257	Failed to create database thread
Ocean 288 Victorious Breakfast	3134536217	Corrupt or invalid string reference (not a string)
Ocean 529 Broken Lamprey	3967909977	Trying to get version of a demo when the demo system is idle.
Ocean 78 Melted Lantern	3677886809	parameter does not exist
Option 102 Grounded Thunder	525308842	GetBaseWeaponItemIndex: invalid weapon named passed.
Option 129 Knockout Rescue	2240566762	entity is not a player
Option 173 Camouflaged Mauler	3142427498	not an object
Option 365 Old Ghoul	2687742442	Forced script exception.
Option 383 Bayou Invasion	1898523690	setblur() called on an invalid client entity.
Option 599 Nitro Fox	3718026602	unknown radiant type
Option 961 Blue Whisper	3523382186	ScrEvent map is full, unable to register new event
Oscar 1009 Emerald Invasion	1908025062	parameter isn't a string
Oscar 283 Barren Eye	4278104166	Illegal objective state, possible values: active, invisible, done, current or failed
Oscar 66 Burn Badger	277765798	Error loading fastfile: uncompressed delta fast file is not supported
Oscar 771 Central Zeus	3329708710	Unable to find default bitfield, dropping
Papa 1018 Rocky Beastmaster	3030895505	Whitelist failure for title
Papa 209 Grey Cadet	1544804945	script stack overflow (too many embedded function calls)
Papa 530 Invisible Hippo	989284113	model not cached by the linker
Papa 586 Proper Cage	3118642961	parameter is not a valid weapon object
Papa 656 Area Jaguar	1088278929	Raw file is not a file of the right type
Papa 810 Right Case	2606724305	parameter does not exist
Papa 859 Fierce Python	1047729873	exitlevel already called
Papa 889 Tall Fury	2940376721	Cannot call SetClientField on 'counter' type clientfield
Prep 161 Nova Discovery	3881402958	not an entity
Prep 251 Late Scorpio	753299086	vector index out of range
Prep 347 Morning Jackpot	3819578766	not a script function pointer
Prep 367 Solar Activity	4039057166	LUINotifyEvent: entity must be a player entity
Prep 374 Aggressive Breakfast	3135792078	Invalid type passed in from array into waittill parameter list
Prep 390 Iron Bison	1109633678	Execution Queue out of memory
Prep 43 Arctic Ship	2147942414	DirectX Not enough storage is available to complete this operation.
Prep 633 October Menace	1438198158	Can't use wait with profiler
Prep 941 Battle Gravedigger	3559732046	script stack overflow (too many embedded function calls)
Quebec 126 Kinetic Mortar	1999906612	type is not a integer or float
Quebec 387 Poison Goodnight	4106063796	key value provided for array is not valid
Quebec 405 Major Mole	2742072756	Can't register more dvar
Quebec 529 Knockout Headquarters	1804370036	Failed to verify file type 
Quebec 646 Tropic Breakfast	3121501044	try to send format param string isn't cached
Quebec 794 Bog Fleet	1697447028	Can't use wait with profiler
Quebec 873 Midnight Operator	1487510644	Could not load gsc object
Quebec 919 Hidden Dawn	4077883892	Param can't be higher than 7
Quebec 965 Dangerous Jackpot	3810601716	undefined param
Queen 114 Rocky Medal	1957162421	Can't find bgCache entry
Queen 116 Classic Rattlesnake	124438261	not a script function pointer
Queen 117 Weak Octopus	71894325	CamAnimScripted or ExtraCamAnimScripted can only be called on a player.
Queen 119 Guerrilla Gremlin	3446625973	not a vector index
Queen 19 Furious Cipher	2626909173	exceeded maximum number of script strings
Queen 233 Calm Specialist	2420909621	no free xpak slots loading pak
Queen 235 Wicked Libra	732489269	Non-player entity passed to UploadStats()
Queen 254 Unfriendly Python	1053986869	GScr_UseBuildKitWeaponModel: called with weapon 'none'
Queen 427 Apocalyptic Treasure	4182670005	invalid session mode
Queen 47 Sick Eagle	325402485	script stack overflow (too many embedded function calls)
Queen 513 Ultraviolet Buffalo	1304594933	unable to spawn entity
Queen 577 Weak Manuever	1967731701	Invalid type passed in from array into waittill parameter list
Queen 770 Wild Traffic	2840917045	SysError in another thread (no msg)
Queen 891 Grey Beastmaster	3021194485	Internal script stack overflow
Queen 964 Shellshocked Rank	2185211445	Can't register dvar
Roger 304 Hurt Honey	3797948576	not an object
Roger 356 Gray Pig	1377489376	Gesture key can't have the higher bit set
Roger 391 Emerald Refuge	4223282976	Error loading fastfile patch header
Roger 440 Unlimited Fox	3723589344	not a function pointer
Roger 630 Shadow Zombie	899599904	first arg to waittill_timeout must evaluate to an integer or float value
Roger 753 Fake Outlaw	4047738848	Invalid opcode (Recovery)
Roger 786 Operation Conquest	3379248928	value out of range (atan)
Roger 850 Grey Whisper	3524483616	Ammo count must not be negative
Roger 853 Lone Platoon	2122198496	The sound globals have been overwritten
Roger 97 Deadly Mole	2738206304	SOUND: sound bank globals overwritten
Romeo 208 Nightshade Homerun	4204328368	Corrupt or invalid string reference (not a string)
Romeo 215 Early Stockade	2481266032	can't cast parameter to string
Romeo 459 Battle Traffic	2838301872	Gesture table key can't have the higher bit set
Romeo 495 Conflicted Eagle	323350640	CScr_FindStaticModelIndexArray: unsupported parameter type
Romeo 534 Axiom Asset	2579736624	Incorrect number of parameters.
Romeo 569 Clipped Squad	2448966512	string too long
Romeo 671 Iron Stallion	941828720	exitlevel already called
Romeo 836 Deadly Scythe	3761634992	not a pointer
Romeo 852 Frozen Eye	4272949040	g_copyInfo exceeded: too many asset overrides in one call to DB_LoadXAssets.
Romeo 913 Blink Demon	546354288	SysError in another thread (msg)
Romeo 967 Tragic Grunt	1782227888	Invalid volume decal index in SetVolumeDecalHidden.
Rush 114 Camouflaged Management	4232965560	divide by 0
Rush 280 Extinct Storm	1403832952	Attempt to register ClientField failed.  Client Field set either already contains a field, or a hash collision has occurred.
Rush 439 Dry Zeus	3328272376	invalid player role
Rush 755 Light Gladiator	3314084408	not a string index
Sail 1020 Clean Goodnight	4101525669	Can't use wait with profiler
Sail 208 Goodbye Arrow	1507063205	CMD_VEH_SetPlaneGoalPos entity is at rest ( speed of 0 ), new speed is needed to make plane move.
Sail 312 Extreme Boa	1072585573	Raw file is not a file of the right type
Sail 323 Stealth Firestarter	3437940389	unable to find animation in tree
Sail 327 Iron Coyote	388183077	missing field name
Sail 397 Skyline Firestarter	3423138661	not a script function pointer
Sail 451 Rare Ultra	2855747045	Blur value must be greater than 0
Sail 506 Blink Alligator	1167129573	key does not internally belong to generic entities
Sail 543 Earth Whisper	3524990949	not an array key
Sail 630 Nuclear Bug	2894056997	DEV: CL_SetCGameTime: !cl->snap.valid
Sail 692 Sapphire Avalanche	833940261	divide by 0
Sail 780 Risky Zombie	897625509	Can't find xasset (name,type)
Sail 899 Good Retreat	2250249765	Corrupt or invalid string reference (not a valid string)
Sail 946 Due Outlander	3922439973	ArraySort: array can only contain entities or structs or vectors
Sail 962 Hidden Buffalo	1292858725	Invalid mission name
Sierra 190 Knight Thunder	530250396	Source Damage vector is invalid.
Sierra 54 Found Treasure	4178589916	Model was not cached by the linker.
South 1020 Calm Potato	2538360978	caller is not an object
South 108 Determined Yeti	3874454418	negative wait is not allowed
South 209 Shadow Stallion	949934674	Invalid Version Handling. Grab Bat !!!
South 263 Confused Artillery	2279633554	SV_SetConfigstring: bad index
South 379 Orange Clover	3657806674	invalid character index
South 719 Natural Breakfast	3135985170	not an array
Spring 361 Right Mauler	3143575744	parameter does not exist
Spring 633 Nova Breakfast	3126405504	Com_Error entered
Spring 741 Area Outlander	3923586368	Kill failed
Spring 756 Right Lizard	375374976	Can't use wait with profiler
Spring 779 Nickel Shell	2367948992	Can't find sha1 hash algorithm
Spring 805 Apollo Valentine	1099145600	Can't find asset
Spring 81 Snap Soldier	2408700928	not a valid name for a clientfield set.
Spring 817 Wild Star	3847549440	Exceeded limit for assets.
Spring 89 Pale Giant	878538048	invalid const string ref
Summer 146 Satellite Ultra	2863351045	bad vm instance
Summer 164 Brass Dove	219569925	hasperk() can only be called on local players
Summer 213 Good Invasion	1897931653	AIType has no characters specified. There should be at least one chatacter associated with an AIType.
Summer 332 River Rank	2183812485	getent used with more than one entity
Summer 347 Boiling Fox	3714655621	Invalid mission name
Summer 43 Sleeper Sabotage	2289696773	DirectX Device Removed
Summer 490 Defiant Eel	48546501	not a function pointer
Summer 494 General Shell	2379198149	waittill must have at least one valid argument
Summer 534 Winning Escort	2681972741	bad clientfield for name
Summer 552 Soaring Siege	2387120645	exceeded string argument limit
Summer 603 Midas Fort	1757941509	divide by 0
Summer 607 Binary Godfather	3251676101	Could not load raw file
Summer 620 Split Legend	2734491973	Error need at least one argument for LUINotifyEvent.
Summer 738 Barracuda Pattern	2782299909	script stack overflow (too many embedded function calls)
Summer 986 Rare Operator	1480037573	Invalid canonical name hash
Tango 383 Emerald Goblin	3468307479	DirectX Error
Tango 516 Advanced Tactics	2498210007	-- can only be used with integer type
