Tango 534 Blind Asset	2572593175	unable to spawn entity
Tango 648 Arctic Ship	2147942487	DirectX Invalid Call.
Tango 758 Fake Dynamite	3577992151	weapon is read-only
Tango 8 Knight Taurus	647662103	parameter can't be cast to a string
Tango 834 Dry Mole	2741070999	not a xhash
Tango 882 Aurora Invasion	1909233687	Optional argument must be a vector type
Tommy 439 Tin Highway	3592841213	cannot directly set the origin on AI.  Use the teleport command instead.
Tommy 443 Destructive Command	1609894461	bad entity
Tommy 478 Determined Volley	2532286589	error message
Tommy 625 Cruel Moon	4131199549	GetVehicleNode - key is not internally a string
Tommy 706 Nitro Bridge	2593952637	not an array
Tommy 833 Rightful Hippo	987874813	self isn't a field object
Tommy 942 Numbered Section	2336297405	Execution Queue out of memory
Uniform 205 Air Gorilla	354335369	Unable to find HierarchicalTaskNetwork asset
Uniform 210 Atomic Infantry	1855943177	parameter doesn't exist
Uniform 31 Empty Jet	1915758537	RegisterClientField can only accept bit ranges between 1 and 32.
Uniform 48 Hurt Conflict	1365291145	invalid gesture in player role template
Uniform 58 Guerrilla Boa	1064295945	Could not allocate asset - increase XASSET_ENTRY_POOL_SIZE
Uniform 587 Nickel Breakfast	3122940489	caller is not an entity
Uniform 854 Positive Jaguar	1088349385	Corrupt or invalid string reference (not a valid string)
Uniform 956 Ace Aquarius	597121289	invalid platoon name (not possible)
Union 138 Shade Tornado	174350744	PMem: failed to free memory (name,stack)
Union 152 Midas Werewolf	969461336	The setHintStringForPlayer command only works on trigger or script mover entities.
Union 254 Reloaded Camo	1576636440	DoubleXPTimerFired: entity must be a player entity
Union 296 Poison Luck	3837625752	abort
Union 326 Boiling Ice	3630798232	caller is not an object
Union 344 Blue Headquarters	1795335576	not an object
Union 701 Sick Eclipse	1013305560	Pointer types passed into waittill expressions must evaluate as arrays
Union 753 Right Shell	2371852248	No tag_barrel for
Union 757 Rare Tank	3291994136	invalid animtree id
Union 851 Taz Centaur	3179607896	ScrVar_AddFields: Can't find file
Union 908 Evil Giant	876169112	key value provided for struct is not valid
Union 958 Mad Retreat	2253722136	CamAnimScripted can only be called on a player.
Vic 227 Recovered Goat	1246470805	mission index out of range
Vic 335 Small Pattern	2769479381	Invalid threat bias group
Vic 366 Crystal Lion	249068885	Failed to allocate from state pool
Vic 415 Aggressive Pisces	619241173	Failed to allocate from element pool
Vic 504 Pale Fury	2942156629	not an array
Vic 520 Barren Scorpio	754846421	invalid vehicle spawn origin
Vic 667 Hidden Defense	1661960405	weapon is read-only
Vic 681 Found Cause	3004202005	entity id too high
Vic 803 Chief Drop	2824316565	parameter does not exist
Vic 820 Nitro Goodnight	4103906837	Entity is not an item.
Vic 983 Extreme Traffic	2851002517	param is not an object
Vice 164 Vengeful Raven	451698481	Unk fastfile load error
Vice 206 Victorious Plane	2111174833	Array index not a valid type, expecting an int, string, or entity type
Vice 344 Spotted Doppelganger	4252738993	script stack overflow (too many embedded function calls)
Vice 400 Tall Dove	222443377	Pointer types passed into waittill_timeout expressions must evaluate as arrays
Vice 499 Desert Avalanche	822874097	network id too high
Vice 535 TD Rookie	562750257	ArraySort can only be called on an Entity which is of type Entity, Path Node, Vehicle Node, or Tacpoint.
Vice 644 Old Formation	1731431985	DirectX Error
Vice 697 Metal Service	2355618801	Gesture table key can't have the higher bit set
Vice 70 Grim Storm	1402557361	bad opcode
Vice 804 Axiom Conquest	3385008561	cannot set field on type
Vice 925 Silent Conflict	1374289393	invalid session mode
Victor 616 Barricaded Fort	1750886746	The setHintString command only works on triggers, script mover entities, or players.
Victor 629 Frozen Gemini	665902298	Parameter must be an array
Victor 727 River Retreat	2250913242	XFile Read error
Victor 768 Golden Wolverine	1137123674	GScr_LUINotifyEvent: Expected Istrings, hash or integers only
Victor 851 Grounded Lion	240121690	waittill_timeout must have at least one valid argument
Victor 857 Covert Formation	1736003354	parameter does not exist
West 243 Brass Cipher	2618727779	The server did not send us a config checksum but we have one
West 415 Midnight Victory	3400130275	VEH_IsSeatOccupied() called on invalid seat position.
West 728 Rocky Goat	1252503459	caller is not an entity
West 9 Unlimited Rat	1190254947	waittill must have at least one valid argument
Whiskey 110 Late Tiger	317100267	unmatching types
Whiskey 13 Copper Menace	1427704235	expected struct type to add value pair
Whiskey 159 Calm Python	1045192683	Scr_RandomFloatRange's second parameter must be greater than the first.
Whiskey 230 Destructive Guardian	3086288875	playFx called with (0 0 0) forward direction
Whiskey 456 Blazing Cause	3015158315	getperks() can only be called on local players
Whiskey 938 Dazed Ship	2162131755	Can't find prng algorithm
Whiskey 960 Emerald Werewolf	968521323	player hasperk(<localClientNum>, <perk>): localClientNum out of range
Winter 564 Goodbye Specialist	2429764318	GetRandomCompatibleAttachmentsForWeapon: Weapon has more than allowed number attachments
Winter 6 Almighty Badger	280703902	parameter does not exist
Winter 70 Sleeper Wolf	8016798	not an object
XRay 274 Sub-zero Dawn	4088624643	Can't find asset
XRay 353 Earth Abyss	3189465155	Invalid bgCache type
XRay 373 Firebrand Mamba	1267091843	GScr_UseBuildKitWeaponModel: when specifying that the weapon is upgraded, a valid camoIndex MUST be specified
XRay 373 Hurt Agent	2556447107	script stack overflow (too many embedded function calls)
XRay 384 Metallic Apocalypse	3362159427	++ can only be used with integer type
XRay 470 Screaming Justice	2974839555	invalid session mode
XRay 552 Burned Station	2792722947	RegisterClientField can only accept 5 parameters
XRay 740 Fire Valentine	1092422851	Optional argument must be of integer type
XRay 775 Split Python	1056823939	Invalid type passed in from array into waittill parameter list
Yankee 106 Dry Spartan	576843940	type is not an anim
Yankee 13 United Wombat	84281764	not a field object
Yankee 220 Divided Intelligence	1895566756	dvar is not a 3d vector, but GetDvarVector3D has been called on it
Yankee 247 Crystal Cyclone	853064292	pathnode is read-only
Yankee 444 Nitro Spartan	580674660	Unknown ent type in GScr_GetFieldSetForEntityType.
Yankee 541 Numbered Boar	104978404	cannot cast type to canon
Yankee 687 Screech Snake	512306404	caller is not an object
Yankee 780 Bad Shell	2368908708	invalid session mode
Yankee 913 Evil Libra	725202020	caller is not an object
Yankee 921 Gothic Navy	2055356644	entity is not a script_brushmodel, script_model, script_origin, probe, or light
Yankee 953 Axiom Helmet	1824757220	calcWeaponOptions takes at least 2 arguments
Yorker 159 Nightshade Karma	3734527949	no character customization table for this mode
Yorker 313 Empty Parachute	2083549197	CScr_FindVolumeDecalIndexArray: unsupported parameter type
Yorker 54 Violet Zombie	889403597	SpawnCollision: Collision model name is not valid
Yorker 553 Broken Lion	243367053	The setHintStringForPlayer command can only change prompts for players.
Yorker 695 Classic Uncle	2875860301	setblur() called on an invalid client entity.
Yorker 721 Nickel Platoon	2116335949	function called with too many parameters
Yorker 902 Small Doppelganger	4245873293	not a path node
Young 100 Skyline Pavement	3607664937	first arg to endon_callback must evaluate to a function value
Young 137 Blind Lantern	3679846953	LUINotifyEvent: entity must be a player entity
Young 598 Patient Command	1601358697	param is not an object
Young 886 Major Payday	3346055721	GetWeapon: array can only contain strings or hashes
Zebra 1005 TD Rat	1183484027	SetSavedDvar(): The dvar does not exist
Zebra 112 Vicious Stallion	946363963	Invalid opcode
Zebra 32 Grizzly Lizard	377246011	invalid session mode
Zebra 84 World Bayonet	1524410875	Execution Queue out of memory
Zebra 868 Metallic Escort	2674310011	invalid session mode
Zebra 909 Aurora Wave	3654063291	ScrEvent map is full, unable to register new event
Zed 105 Riptide Volley	2517242050	parameter does not exist
Zed 135 Titanium Ant	1193670850	parameter is not a valid weapon index
Zed 170 Extreme Gorilla	367932162	ArraySort: array contains more than 4096 entities
Zed 251 Silent Scorpio	753495682	RandomIntRange's second parameter must be greater than the first.
Zed 380 Nickel Rank	2183416258	uploadLeaderboards: entity must be a player entity
Zed 41 Chief Rodeo	3159820546	invalid session mode
Zed 453 Kinetic Devil	1211376898	DEV: Could not load level fastfile for level
Zed 606 Tin Refuge	4213634562	precacheLeaderboards must be called before any wait statements in the gametype or level script
Zed 675 Axiom Manuever	1975752514	DirectX Error
Zed 696 Clean Mauler	3145219970	Objective not found in bgcache. Add an objective asset and add that asset to a loaded objectivelist asset.
Zed 711 Resolute Raven	446529346	the function can only be used with string or hash
Zed 737 United Parole	2751867714	self isn't a field object
Zulu 198 Split Clover	3674028780	Invalid type in waittill parameter list
Zulu 339 Red Dementor	3221522156	Failed to alloc client field
Zulu 402 December Capricorn	785010092	Can't use wait with profiler
Zulu 442 Silver Cage	3105354540	Can't register dvar
Zulu 523 Electric Lion	247375020	Attempting to register client field in client field set using bits, but system is out of space.
Zulu 53 Heavy Cause	3016026156	Can't find asset
Zulu 540 Grim Refuge	4221135532	Optional argument must be a string type
Zulu 636 Conflicted Conflict	1363519084	key is not internally a string
Zulu 770 Mountain Traffic	2836526124	value out of range (acos)
Zulu 974 Winning Clover	3671833516	accuracy mod must be nonnegative